{
  "wrs_version": "1.0",
  "marker_id": "urn:example:marker:t_f",
  "worldline_id": "urn:example:worldline:1",
  "marker_type": "t_f",
  "coordinate": null,
  "status": "not_supplied",
  "method": {
    "method_id": "urn:example:method:failure",
    "version": "1.0"
  },
  "evidence_horizon": {
    "system": "turn",
    "value": 47,
    "unit": "turn"
  },
  "evidence_refs": [],
  "qualification": null
}
